{
  "$schema": "http://json-schema.org/draft-07/schema#",
  "title": "AnalysisBuddy Plugin Manifest",
  "description": "JSON Schema (draft-07) for the AnalysisBuddy plugin manifest file (plugin.json), protocol v1. Mirrors docs/spec/protocol-v1.md section 7. Unknown top-level fields are permitted (additionalProperties: true).",
  "type": "object",
  "required": ["id", "display_name", "version", "entry", "match", "min_protocol_version"],
  "properties": {
    "id": {
      "type": "string",
      "pattern": "^[a-z0-9][a-z0-9-_]{1,63}$",
      "description": "Globally unique plugin id. Must equal the id returned by initialize."
    },
    "display_name": {
      "type": "string",
      "minLength": 1,
      "description": "Human-readable display name."
    },
    "version": {
      "type": "string",
      "pattern": "^(0|[1-9][0-9]*)\\.(0|[1-9][0-9]*)\\.(0|[1-9][0-9]*)(-[0-9A-Za-z.-]+)?(\\+[0-9A-Za-z.-]+)?$",
      "description": "Plugin version, semver, e.g. \"0.1.0\"."
    },
    "entry": {
      "type": "object",
      "required": ["command", "args"],
      "description": "Process launch entry, resolved relative to the plugin.json directory.",
      "properties": {
        "command": {
          "type": "string",
          "minLength": 1,
          "description": "Executable command. Always resolved relative to the plugin.json directory; global PATH must not be relied on (interpreter-style entries excepted)."
        },
        "args": {
          "type": "array",
          "items": { "type": "string" },
          "description": "Command-line arguments. May be an empty array."
        },
        "working_dir": {
          "type": "string",
          "minLength": 1,
          "description": "Process working directory, resolved relative to the plugin.json directory. Defaults to the plugin.json directory."
        }
      }
    },
    "match": {
      "type": "object",
      "required": ["extensions"],
      "description": "File matching rules. Pre-filter at discovery; the authoritative judgement still goes through can_handle.",
      "properties": {
        "extensions": {
          "type": "array",
          "items": { "type": "string" },
          "description": "Claimed file extensions (lowercase, no dot). An empty array means fingerprint-only matching."
        },
        "header_fingerprints": {
          "type": "array",
          "items": { "type": "string" },
          "description": "Header fingerprints: case-insensitive substring matches against the head sample; any hit makes the file a candidate."
        }
      }
    },
    "min_protocol_version": {
      "type": "integer",
      "minimum": 1,
      "description": "Minimum required protocol version. When greater than the host-supported version the plugin is not loaded and the host suggests upgrading."
    },
    "author": {
      "type": "string",
      "description": "Optional author name. If present it must be a non-empty string (MAN-10)."
    },
    "repository": {
      "type": "string",
      "description": "Optional source repository URL. If present it must be a valid https URL (MAN-10; TLS enforced, plain http rejected). May also serve as the value of update_url."
    },
    "tools": {
      "type": "array",
      "items": { "type": "string" },
      "description": "Optional adapter constraints, each entry in `{tool} {VersionReq}` syntax, e.g. \"AnalysisBuddy >= 0.2.0\" (MAN-11). The host checks its own identity and version against these."
    },
    "update_url": {
      "type": "string",
      "description": "Optional update source, a https://github.com repository (full URL or bare owner/repo). Validation and consumption are host-side (module manager); the validator does not judge this field."
    },
    "changelog": {
      "type": "array",
      "items": {
        "type": "object",
        "properties": {
          "version": {
            "type": "string",
            "description": "Entry version, semver (MAN-12)."
          },
          "date": {
            "type": "string",
            "description": "Entry date, YYYY-MM-DD (MAN-12)."
          },
          "notes": {
            "type": "array",
            "items": { "type": "string" },
            "description": "Entry notes, an array of strings (MAN-12)."
          }
        }
      },
      "description": "Optional version history. When non-empty, entries must be strictly descending by semver and the manifest's own version must appear (MAN-13)."
    },
    "presets": {
      "type": "array",
      "maxItems": 32,
      "description": "Optional scene presets (addendum): each preset describes how to identify a set of metrics this scene cares about, from the plugin's own metric ids/names. The core treats scene semantics as open - plugin authors name their own scenes. Entries are exhaustively matched against the plugin's metric list at apply time.",
      "items": {
        "type": "object",
        "required": ["id", "name"],
        "properties": {
          "id": { "type": "string", "pattern": "^[a-z0-9][a-z0-9-_]{0,63}$", "description": "Preset id, 1-64 chars, lowercase/digits/-/_." },
          "name": { "$ref": "#/definitions/localized_name", "description": "Bilingual display name; zh and en both required." },
          "description": { "$ref": "#/definitions/localized_name", "description": "Optional bilingual description." },
          "entries": {
            "type": "array",
            "maxItems": 1000,
            "description": "Top-level entries, effective for every group.",
            "items": { "$ref": "#/definitions/preset_entry" }
          },
          "groups": {
            "type": "array",
            "items": {
              "type": "object",
              "required": ["id", "name"],
              "properties": {
                "id": { "type": "string" },
                "name": { "$ref": "#/definitions/localized_name" },
                "entries": { "type": "array", "maxItems": 1000, "items": { "$ref": "#/definitions/preset_entry" } }
              }
            }
          },
          "keywords": { "type": "array", "items": { "type": "string", "minLength": 1 }, "description": "Fuzzy fallback keywords, enabled only when exhaustive matching is entirely empty. Each entry must be a non-empty string (blank keywords are filtered by the host)." }
        }
      }
    }
  },
  "additionalProperties": true,
  "definitions": {
    "localized_name": {
      "type": "object",
      "required": ["zh", "en"],
      "properties": { "zh": { "type": "string", "minLength": 1 }, "en": { "type": "string", "minLength": 1 } }
    },
    "preset_entry": {
      "type": "object",
      "required": ["names"],
      "properties": {
        "want": { "type": "string", "description": "Optional semantic slot id; for the same want only the first hit takes effect." },
        "names": { "type": "array", "minItems": 1, "items": { "type": "string" }, "description": "Candidate names: normalized metric_id or raw metric name." }
      }
    }
  }
}
